{
  "schema_version": 1,
  "id": "lcdm-baseline-reference-audit",
  "title": "Full ΛCDM reference",
  "kind": "single_mechanism",
  "readiness": "blocked",
  "baseline": {
    "label": "Planck 2018 base ΛCDM",
    "role": "comparison",
    "scope": "Source-defined full reference, not a theory verdict.",
    "parameters": null,
    "parameters_reason": "Exact sourced values and chosen inputs are separately pinned in the candidate numerical reference."
  },
  "cosmology": {
    "gravity": "General relativity",
    "geometry": "Spatially flat FLRW",
    "components": [
      "Baryons",
      "Cold dark matter",
      "Photons",
      "Two effectively massless neutrino states",
      "One 0.06 eV neutrino state",
      "Cosmological constant"
    ],
    "modifications": [],
    "background": "Full baryon/CDM/photon/neutrino/Lambda background; massive-neutrino density changes thermal regime.",
    "perturbations": "Source requires adiabatic power-law primordial perturbations and Boltzmann/recombination/reionization/lensing closure; current full reproduction blocked.",
    "observables": [
      "H(z)",
      "Comoving/luminosity distances",
      "Drag ruler and BAO distance/ruler ratios",
      "Standardized SN distance residuals"
    ]
  },
  "scope": [
    "Identify supported calculations and explicit blockers. No faithful full Planck reproduction until closure and likelihoods are implemented."
  ],
  "unknowns": [
    "Complete source readings have not occurred in this targeted task.",
    "Consumer release asset hashes, exact selections and comparison budgets belong to the Reproducible packet and are not yet accepted here.",
    "Unknown cross-probe covariances stay unknown.",
    "Faithful Planck physics and full likelihood stack are not implemented."
  ],
  "combination_compatibility": {
    "status": "source_coherent",
    "basis": "One declared background; observable lineage ideas inform the investigation, not extra physical components or independent probes."
  },
  "idea_ids": [
    "planck-conditioned-base-lcdm",
    "bao-compressed-relative-ruler",
    "sn-standardized-distance-lineage"
  ],
  "model_idea_ids": [
    "planck-conditioned-base-lcdm"
  ],
  "paper_ids": [
    "arxiv:1807.06209v4",
    "arxiv:2503.14738v3",
    "arxiv:2202.04077v2",
    "arxiv:2112.03863v2",
    "arxiv:2112.03864v2",
    "arxiv:2112.04510v3"
  ],
  "design_ids": [
    "candidate-lcdm-baseline-reference-audit"
  ],
  "topic_ids": [
    "baseline-reference"
  ],
  "review_id": "2026-10-01-lcdm-baseline-source-claims",
  "source_evidence": [
    {
      "paper_id": "arxiv:1807.06209v4",
      "locator": "HTML S2.SS1 (Sec2.1): six sampled parameters, adiabatic power law, 0.05 Mpc^-1 pivot, one 0.06 eV plus two massless neutrinos, BBN PArthENoPE1.1/neutron880.2s; HTML S3.T1 caption: Plik marginalized means versus best fit, massive neutrino included in Omega_m, theta_MC versus theta_star; HTML S3.SS1 footnote14: T_CMB2.7255K; PDF p16 Table2: all eleven registered values/errors and TT,TE,EE+lowE+lensing column; no BAO; tanh reionization and BBN helium caption; HTML S7.SS5.SSS2: standard Neff3.046 text; Eq62 read but not used",
      "url": "https://arxiv.org/abs/1807.06209v4",
      "source_sha256": {
        "html": "622d05fab48d935a2224afeade05b07393ec37e4e0554bb9c416f4298acb7bc0",
        "pdf": "8e172730faf07c9f4ff3fdcc7043f76ed67df6f76066d47df30d693025b6ce77",
        "extracted_text": "75476bdbcfeb893c3be2274cb796becf55a9a174c40b4c265a9fcc9870fa0a4d"
      }
    },
    {
      "paper_id": "arxiv:2503.14738v3",
      "locator": "HTML S1.E1, S1.E4, S1.E5, S1.EGx2: drag ruler, flat comoving transverse distance, radial distance and full neutrino background; HTML S3.SS1 and Eqs11–12: fiducial BAO templates, nuisance marginalization, DV definition and fit conditioning; HTML S3.T4 caption and seven used tracer rows: marginal means/stddev, systematic budget, superseded LRG3/ELG1 excluded; HTML S3.SS3: seven baseline distance measurements; BAO-only Omega_m and H0*r_d dependence; DR1 shares data with DR2; HTML S4.SS3: SN offsets/calibration degeneracy and sample overlap; HTML S5 and S6.E17: BAO-only sampled parameters and conditioned fitted result, not used as executable controls; HTML A2: baseline inter-bin systematic independence assumption and correlated-systematics sensitivity test",
      "url": "https://arxiv.org/abs/2503.14738v3",
      "source_sha256": {
        "html": "782d7b25d5a6d7195e0dc0cfdab029e49a4b05cff8263e18f843e82e9c054c49"
      }
    },
    {
      "paper_id": "arxiv:2202.04077v2",
      "locator": "HTML S1: 1701 light curves,1550 distinct SNe; SH0ES shares Pantheon+ distances/covariance and42 calibrator hosts; HTML S2.SS2 Eqs5–8: duplicate-light-curve statistical covariance and systematic covariance; rows are light curves; HTML S2.SS3 Eqs9–15: covariance quadratic, residual and modulus, flat luminosity distance, M/H0 degeneracy, calibrated-host residuals plus Cepheid covariance; HTML S3.SS1.SSS2: peculiar-velocity-corrected CMB-frame redshift versus heliocentric fitting redshift; calibrator redshifts not used for Cepheid comparison; HTML S4.SS3: cosmological-fit conditioning context, not accepted as independent H0 data",
      "url": "https://arxiv.org/abs/2202.04077v2",
      "source_sha256": {
        "html": "7580cd8300bf5bf53119735a06c94f7240a7426c37a4f2e8fdbf9915905ecb38"
      }
    },
    {
      "paper_id": "arxiv:2112.03863v2",
      "locator": "HTML S2.SS1 Eq1: SALT2 light-curve standardization and simulation-dependent bias/host correction; HTML S2.SS2 and Table2: selection/training domain, quality/bias/systematics cuts; final1701 rows; HTML S3.SS2: duplicate identity matching, per-survey fits retained with covariance, common ladder survey ancestry",
      "url": "https://arxiv.org/abs/2112.03863v2",
      "source_sha256": {
        "html": "2c853a30cad35cd63a3097520235e5e772c645f717aba847708eecc2e5cb98a0",
        "pdf": "c42406c774a1f09ba520238b4bbe6bbcba81fec6171fdf0064d7c4dca583b9c9",
        "extracted_text": "7da8e4b3109fad1c207199775bc0a7ff6376fa33e979681cbd58b0f4a367b528"
      }
    },
    {
      "paper_id": "arxiv:2112.03864v2",
      "locator": "HTML S2.SS2: shared CALSPEC/NGSL standards and homogenized calibration; HTML S3.SS1: simultaneous105-filter calibration offsets/priors produce covariance between surveys; HTML S4.SS3 Eq7: correlated zeropoint realizations, joint SALT2 retraining/photometry propagation to distance covariance; HTML S5.SS3: calibration/training correlated systematic uncertainty context",
      "url": "https://arxiv.org/abs/2112.03864v2",
      "source_sha256": {
        "html": "5e042f44faa5204afb941c9e8914d6920409a67429673bc8ac01e6c990265805",
        "pdf": "022ae1a5fa3ceda36caac295c1a4cc0b1ef4cab28f818564c62e353e1750ae74",
        "extracted_text": "506a368e04799fc73ef511dae88c15a11a85610e19ad25e36af76ff60831c6d4"
      }
    },
    {
      "paper_id": "arxiv:2112.04510v3",
      "locator": "PDF/extracted-text title and abstract: pinned v3 identity, baseline73.04±1.04 km/s/Mpc is conditioned ladder inference, not raw observation; PDF Sec2.1 pp9–12 Eqs1–6: Cepheid standardization, geometric anchor constraints, colocated SN calibration, cosmographic intercept, logH0 relation, simultaneous covariance fit; Rendered PDF p10: Eqs2–5 and covariance dependence prose; Rendered PDF p11: calibrator/Hubble-flow SNcov cross blocks; Rendered PDF p12: design matrix/free parameters and Eq6 covariance quadratic",
      "url": "https://arxiv.org/abs/2112.04510v3",
      "source_sha256": {
        "pdf": "572e5d2c0f32bf6e80a118eec13ed0107e1e2830f9ebe90b5bc4e9d1b7fa5df1",
        "extracted_text": "cb075a9089294197178ea49385657839a15554b32b497f15e490782c48589c5e"
      }
    }
  ]
}
